ticker,security_id,company_name,role,weight,purity,importance,effective_from,active,membership_source,inclusion_reason,reviewed_at,reviewed_by,source_url,source_retrieved_at,previous_ticker,previous_company_name,corporate_action_type,corporate_action_effective_date,continuity_status,history_continuity_required,notes
MU,sec-a24c631b902b547e,Micron Technology,core,0.142857142857,100,10,2026-07-20,true,human-reviewed-v1.2,Primary DRAM and NAND memory producer.,2026-07-20T00:00:00Z,AndyPun123123,https://www.micron.com/about/company/corporate-profile,2026-07-20,,,,,,,Approved correction of v1.1 metadata
SNDK,theme-sec-sndk,Sandisk Corporation,core,0.142857142857,100,9,2026-07-20,true,human-reviewed-v1.2,Flash-storage products and platforms.,2026-07-20T00:00:00Z,AndyPun123123,https://www.sandisk.com/about/,2026-07-20,,,,,,,Approved correction of v1.1 metadata
WDC,theme-sec-wdc,Western Digital,core,0.142857142857,95,8,2026-07-20,true,human-reviewed-v1.2,Storage devices and data infrastructure platforms.,2026-07-20T00:00:00Z,AndyPun123123,https://www.westerndigital.com/company,2026-07-20,,,,,,,Approved correction of v1.1 metadata
STX,theme-sec-stx,Seagate Technology,core,0.142857142857,95,8,2026-07-20,true,human-reviewed-v1.2,Mass-capacity storage supplier.,2026-07-20T00:00:00Z,AndyPun123123,https://www.seagate.com/company/,2026-07-20,,,,,,,Approved correction of v1.1 metadata
MRVL,theme-sec-mrvl,Marvell Technology,infrastructure,0.142857142857,70,6,2026-07-20,true,human-reviewed-v1.2,Storage and data-infrastructure semiconductor exposure.,2026-07-20T00:00:00Z,AndyPun123123,https://www.marvell.com/company.html,2026-07-20,,,,,,,Approved correction of v1.1 metadata
NTAP,theme-sec-ntap,NetApp,infrastructure,0.142857142857,80,5,2026-07-20,true,human-reviewed-v1.2,Enterprise data-storage systems and cloud data platforms.,2026-07-20T00:00:00Z,AndyPun123123,https://www.netapp.com/company/,2026-07-20,,,,,,,Approved correction of v1.1 metadata
P,theme-sec-everpure-1474432,Everpure,infrastructure,0.142857142857,90,6,2026-07-20,true,human-reviewed-v1.2,Enterprise flash-storage systems and data-storage platforms.,2026-07-20T00:00:00Z,AndyPun123123,https://www.sec.gov/Archives/edgar/data/1474432/000147443226000011/pstg-20260223.htm,2026-07-20,PSTG,Pure Storage,ticker_and_name_change,2026-04-17,verified,true,Same issuer corporate-action continuity remains verified
